{
	"$schema": "https://raw.githubusercontent.com/earendil-works/pi/main/packages/coding-agent/src/modes/interactive/theme/theme-schema.json",
	"name": "ocean",
	"vars": {
		"cyan": "#22d3ee",
		"sky": "#38bdf8",
		"teal": "#2dd4bf",
		"green": "#4ade80",
		"red": "#fb7185",
		"amber": "#fbbf24",
		"text": "#e0f2fe",
		"gray": "#7dd3fc",
		"dimGray": "#64748b",
		"darkGray": "#334155",
		"accent": "#22d3ee",
		"selectedBg": "#164e63",
		"userMsgBg": "#122636",
		"toolPendingBg": "#0f172a",
		"toolSuccessBg": "#052e1a",
		"toolErrorBg": "#3f1d24",
		"customMsgBg": "#123a52",
		"mdCodeBg": "#0e1c28"
	},
	"colors": {
		"accent": "accent",
		"border": "sky",
		"borderAccent": "cyan",
		"borderMuted": "darkGray",
		"success": "green",
		"error": "red",
		"warning": "amber",
		"muted": "dimGray",
		"dim": "dimGray",
		"text": "text",
		"thinkingText": "gray",

		"selectedBg": "selectedBg",
		"userMessageBg": "userMsgBg",
		"userMessageText": "text",
		"customMessageBg": "customMsgBg",
		"customMessageText": "text",
		"customMessageLabel": "#67e8f9",
		"toolPendingBg": "toolPendingBg",
		"toolSuccessBg": "toolSuccessBg",
		"toolErrorBg": "toolErrorBg",
		"toolTitle": "accent",
		"toolOutput": "gray",
		"mdCodeBg": "mdCodeBg",

		"mdHeading": "#67e8f9",
		"mdHeadingMuted": "#22d3ee",
		"mdLink": "#38bdf8",
		"mdLinkUrl": "dimGray",
		"mdCode": "#7dd3fc",
		"mdCodeBlock": "cyan",
		"mdCodeBlockBorder": "darkGray",
		"mdQuote": "#7dd3fc",
		"mdQuoteBorder": "accent",
		"mdHr": "darkGray",
		"mdListBullet": "cyan",
		"mdTableBorder": "darkGray",
		"mdKbd": "#bae6fd",
		"mdMark": "#67e8f9",

		"toolDiffAdded": "green",
		"toolDiffRemoved": "red",
		"toolDiffContext": "gray",

		"syntaxComment": "#64748b",
		"syntaxKeyword": "#22d3ee",
		"syntaxFunction": "#67e8f9",
		"syntaxVariable": "#7dd3fc",
		"syntaxString": "#5eead4",
		"syntaxNumber": "#38bdf8",
		"syntaxType": "#2dd4bf",
		"syntaxOperator": "#e0f2fe",
		"syntaxPunctuation": "#e0f2fe",

		"thinkingOff": "darkGray",
		"thinkingMinimal": "#64748b",
		"thinkingLow": "#0ea5e9",
		"thinkingMedium": "#22d3ee",
		"thinkingHigh": "#67e8f9",
		"thinkingXhigh": "#a5f3fc",

		"bashMode": "green"
	},
	"export": {
		"pageBg": "#07111c",
		"cardBg": "#0b1a28",
		"infoBg": "#3b2f1f"
	}
}
