{
	"$schema": "https://raw.githubusercontent.com/earendil-works/pi/main/packages/coding-agent/src/modes/interactive/theme/theme-schema.json",
	"name": "purple",
	"vars": {
		"violet": "#c084fc",
		"orchid": "#e879f9",
		"indigo": "#818cf8",
		"green": "#86efac",
		"red": "#f87171",
		"amber": "#fbbf24",
		"text": "#e9e4f5",
		"gray": "#9b92b3",
		"dimGray": "#6f6685",
		"darkGray": "#4a4260",
		"accent": "#c084fc",
		"selectedBg": "#3b2f55",
		"userMsgBg": "#1e3a5f",
		"toolPendingBg": "#1f1830",
		"toolSuccessBg": "#1a2a22",
		"toolErrorBg": "#2e1a24",
		"customMsgBg": "#2d2142",
		"mdCodeBg": "#1a2f45"
	},
	"colors": {
		"accent": "accent",
		"border": "indigo",
		"borderAccent": "orchid",
		"borderMuted": "darkGray",
		"success": "green",
		"error": "red",
		"warning": "amber",
		"muted": "gray",
		"dim": "dimGray",
		"text": "text",
		"thinkingText": "gray",

		"selectedBg": "selectedBg",
		"userMessageBg": "userMsgBg",
		"userMessageText": "text",
		"customMessageBg": "customMsgBg",
		"customMessageText": "text",
		"customMessageLabel": "#d8b4fe",
		"toolPendingBg": "toolPendingBg",
		"toolSuccessBg": "toolSuccessBg",
		"toolErrorBg": "toolErrorBg",
		"toolTitle": "accent",
		"toolOutput": "gray",
		"mdCodeBg": "mdCodeBg",

		"mdHeading": "#f0abfc",
		"mdHeadingMuted": "#c084fc",
		"mdLink": "#a5b4fc",
		"mdLinkUrl": "dimGray",
		"mdCode": "#7dd3fc",
		"mdCodeBlock": "#38bdf8",
		"mdCodeBlockBorder": "darkGray",
		"mdQuote": "#b8a9d4",
		"mdQuoteBorder": "accent",
		"mdHr": "darkGray",
		"mdListBullet": "orchid",
		"mdTableBorder": "darkGray",
		"mdKbd": "#bae6fd",
		"mdMark": "#f0abfc",

		"toolDiffAdded": "green",
		"toolDiffRemoved": "red",
		"toolDiffContext": "gray",

		"syntaxComment": "#7c6f99",
		"syntaxKeyword": "#c084fc",
		"syntaxFunction": "#f0abfc",
		"syntaxVariable": "#c4b5fd",
		"syntaxString": "#f9a8d4",
		"syntaxNumber": "#a5b4fc",
		"syntaxType": "#e879f9",
		"syntaxOperator": "#e9e4f5",
		"syntaxPunctuation": "#e9e4f5",

		"thinkingOff": "darkGray",
		"thinkingMinimal": "#6f6685",
		"thinkingLow": "#818cf8",
		"thinkingMedium": "#a78bfa",
		"thinkingHigh": "#c084fc",
		"thinkingXhigh": "#e879f9",

		"bashMode": "green"
	},
	"export": {
		"pageBg": "#140f1f",
		"cardBg": "#1c152c",
		"infoBg": "#3b2f1f"
	}
}
