{
	"$schema": "https://raw.githubusercontent.com/earendil-works/pi/main/packages/coding-agent/src/modes/interactive/theme/theme-schema.json",
	"name": "nord",
	"vars": {
		"frost": "#88c0d0",
		"sky": "#81a1c1",
		"blue": "#5e81ac",
		"green": "#a3be8c",
		"red": "#bf616a",
		"amber": "#ebcb8b",
		"text": "#eceff4",
		"gray": "#d8dee9",
		"dimGray": "#4c566a",
		"darkGray": "#3b4252",
		"accent": "#88c0d0",
		"selectedBg": "#434c5e",
		"userMsgBg": "#3b4252",
		"toolPendingBg": "#2e3440",
		"toolSuccessBg": "#2a3328",
		"toolErrorBg": "#3b2a2e",
		"customMsgBg": "#3b4252",
		"mdCodeBg": "#2e3440"
	},
	"colors": {
		"accent": "accent",
		"border": "sky",
		"borderAccent": "frost",
		"borderMuted": "darkGray",
		"success": "green",
		"error": "red",
		"warning": "amber",
		"muted": "dimGray",
		"dim": "dimGray",
		"text": "text",
		"thinkingText": "gray",

		"selectedBg": "selectedBg",
		"userMessageBg": "userMsgBg",
		"userMessageText": "text",
		"customMessageBg": "customMsgBg",
		"customMessageText": "text",
		"customMessageLabel": "#8fbcbb",
		"toolPendingBg": "toolPendingBg",
		"toolSuccessBg": "toolSuccessBg",
		"toolErrorBg": "toolErrorBg",
		"toolTitle": "accent",
		"toolOutput": "gray",
		"mdCodeBg": "mdCodeBg",

		"mdHeading": "#88c0d0",
		"mdHeadingMuted": "#81a1c1",
		"mdLink": "#81a1c1",
		"mdLinkUrl": "dimGray",
		"mdCode": "frost",
		"mdCodeBlock": "green",
		"mdCodeBlockBorder": "darkGray",
		"mdQuote": "#d8dee9",
		"mdQuoteBorder": "accent",
		"mdHr": "darkGray",
		"mdListBullet": "frost",
		"mdTableBorder": "darkGray",
		"mdKbd": "#e5e9f0",
		"mdMark": "#ebcb8b",

		"toolDiffAdded": "green",
		"toolDiffRemoved": "red",
		"toolDiffContext": "gray",

		"syntaxComment": "#616e88",
		"syntaxKeyword": "#81a1c1",
		"syntaxFunction": "#88c0d0",
		"syntaxVariable": "#d8dee9",
		"syntaxString": "#a3be8c",
		"syntaxNumber": "#b48ead",
		"syntaxType": "#8fbcbb",
		"syntaxOperator": "#eceff4",
		"syntaxPunctuation": "#eceff4",

		"thinkingOff": "darkGray",
		"thinkingMinimal": "#4c566a",
		"thinkingLow": "#5e81ac",
		"thinkingMedium": "#81a1c1",
		"thinkingHigh": "#88c0d0",
		"thinkingXhigh": "#8fbcbb",

		"bashMode": "green"
	},
	"export": {
		"pageBg": "#2e3440",
		"cardBg": "#3b4252",
		"infoBg": "#4c4430"
	}
}
