{
	"$schema": "https://raw.githubusercontent.com/earendil-works/pi/main/packages/coding-agent/src/modes/interactive/theme/theme-schema.json",
	"name": "pink",
	"vars": {
		"blossom": "#f9a8d4",
		"pink": "#f472b6",
		"rose": "#ec4899",
		"peach": "#fda4af",
		"lavender": "#e9d5ff",
		"mint": "#6ee7b7",
		"green": "#86efac",
		"red": "#fb7185",
		"amber": "#fbbf24",
		"text": "#5c3f4a",
		"mediumGray": "#a67b8a",
		"dimGray": "#c49aab",
		"lightGray": "#f0d4e0",
		"accent": "#f472b6",
		"selectedBg": "#fce7f3",
		"userMsgBg": "#fdf2f8",
		"toolPendingBg": "#fdf2f8",
		"toolSuccessBg": "#ecfdf5",
		"toolErrorBg": "#fff1f2",
		"customMsgBg": "#fce7f3",
		"mdCodeBg": "#fff5f8"
	},
	"colors": {
		"accent": "accent",
		"border": "blossom",
		"borderAccent": "pink",
		"borderMuted": "lightGray",
		"success": "green",
		"error": "red",
		"warning": "amber",
		"muted": "mediumGray",
		"dim": "dimGray",
		"text": "text",
		"thinkingText": "mediumGray",

		"selectedBg": "selectedBg",
		"userMessageBg": "userMsgBg",
		"userMessageText": "text",
		"customMessageBg": "customMsgBg",
		"customMessageText": "text",
		"customMessageLabel": "#db2777",
		"toolPendingBg": "toolPendingBg",
		"toolSuccessBg": "toolSuccessBg",
		"toolErrorBg": "toolErrorBg",
		"toolTitle": "rose",
		"toolOutput": "mediumGray",
		"mdCodeBg": "mdCodeBg",

		"mdHeading": "rose",
		"mdHeadingMuted": "pink",
		"mdLink": "#e879f9",
		"mdLinkUrl": "dimGray",
		"mdCode": "#db2777",
		"mdCodeBlock": "rose",
		"mdCodeBlockBorder": "lightGray",
		"mdQuote": "mediumGray",
		"mdQuoteBorder": "blossom",
		"mdHr": "lightGray",
		"mdListBullet": "pink",
		"mdTableBorder": "lightGray",
		"mdKbd": "rose",
		"mdMark": "peach",

		"toolDiffAdded": "mint",
		"toolDiffRemoved": "red",
		"toolDiffContext": "mediumGray",

		"syntaxComment": "#c49aab",
		"syntaxKeyword": "#ec4899",
		"syntaxFunction": "#db2777",
		"syntaxVariable": "#9d174d",
		"syntaxString": "#be185d",
		"syntaxNumber": "#c026d3",
		"syntaxType": "#e879f9",
		"syntaxOperator": "#5c3f4a",
		"syntaxPunctuation": "#5c3f4a",

		"thinkingOff": "lightGray",
		"thinkingMinimal": "#e8b4cb",
		"thinkingLow": "#f9a8d4",
		"thinkingMedium": "#f472b6",
		"thinkingHigh": "#ec4899",
		"thinkingXhigh": "#db2777",

		"bashMode": "mint"
	},
	"export": {
		"pageBg": "#fff5f8",
		"cardBg": "#ffffff",
		"infoBg": "#fce7f3"
	}
}
